Task Name,Original Date,New Date
Initial Cross-Functional Team Collaboration Session,3/25/2025,4/10/2025
Comprehensive User Experience Design Documentation,3/30/2025,4/17/2025
Stakeholder Requirements Validation and Alignment,4/5/2025,4/20/2025
Executive Leadership Strategic Project Presentation,4/8/2025,4/22/2025
Infrastructure Architecture Planning and Assessment,4/10/2025,4/24/2025
First Development Milestone and Capability Review,4/15/2025,5/1/2025
Technical Debt Evaluation and Remediation Planning,4/18/2025,5/5/2025
Mid-Project Deliverables Assessment and Reporting,4/22/2025,5/8/2025
Second Sprint Completion and Feature Demonstration,4/28/2025,5/12/2025
Quality Assurance Testing Protocol Implementation,4/30/2025,5/15/2025
Cross-Browser Compatibility Testing and Resolution,5/8/2025,5/22/2025
User Documentation and Training Material Completion,5/15/2025,5/30/2025
Final Stakeholder Review and Sign-off Procedures,5/20/2025,6/5/2025
Production Environment Configuration and Setup,5/25/2025,6/10/2025
Application Deployment and Monitoring Initiation,5/31/2025,6/15/2025
Post-Implementation Performance Analysis and Report,6/15/2025,6/30/2025

